[
	{
		"id": "allthenticate",
		"title": "Allthenticate Guest Speaker",
		"description": "From Beginner Meetings",
		"path": "/images/general/allthenticate.avif"
	},
	{
		"id": "austinPoint",
		"title": "Austin Teaches Networking",
		"description": "From Cisco Networking Academy (Lab)",
		"path": "/images/general/austin-point.avif",
		"embelishment": "Our expert student mentors will meet you at your level, no matter what that level may be."
	},
	{
		"id": "badApple",
		"title": "Bad Apple Printout",
		"description": "From an unknown competition",
		"path": "/images/general/bad-apple.avif"
	},
	{
		"id": "ciscoGigEm",
		"title": "Cisco Lab Completed",
		"description": "From Cisco Networking Academy (Lab)",
		"path": "/images/general/cisco-gig-em.avif"
	},
	{
		"id": "ciscoHuge",
		"title": "Lesson Lab",
		"description": "From Cisco Networking Academy",
		"path": "/images/general/cisco-huge.avif"
	},
	{
		"id": "ciscoSmile",
		"title": "Halo LAN Party",
		"description": "From Cisco Networking Academy (Lab)",
		"path": "/images/general/cisco-smile.avif"
	},
	{
		"id": "ciscoSoyjak",
		"title": "Wireless Configurations",
		"description": "From Cisco Networking Academy (Lab)",
		"path": "/images/general/cisco-soyjak.avif"
	},
	{
		"id": "colbyMasterChef",
		"title": "Master 'Chef' Colby",
		"description": "From Cisco Networking Academy (Halloween)",
		"path": "/images/general/colby-master-chef.avif"
	},
	{
		"id": "infoGavin",
		"title": "Informational Game",
		"description": "From the Spring 2025 Informational",
		"path": "/images/general/info-gavin.avif",
		"embelishment": "Be a part of the greater cybersecurity community and get the chance to make a real impact."
	},
	{
		"id": "informational",
		"title": "Informational Overhead",
		"description": "From the Fall 2024 Informational",
		"path": "/images/general/informational.avif"
	},
	{
		"id": "ists",
		"title": "On the Grind",
		"description": "From the ISTS 2025 Competition",
		"path": "/images/general/ists.avif"
	},
	{
		"id": "leadership",
		"title": "Leadership Group Photo",
		"description": "All Leadership for 2025-2026",
		"path": "/images/general/leadership.avif"
	},
	{
		"id": "makingWires",
		"title": "Making Wires",
		"description": "From Cisco Networking Academy",
		"path": "/images/general/making-wires.avif"
	},
	{
		"id": "mimic",
		"title": "Mimic Guest Speaker",
		"description": "From Beginner Meetings",
		"path": "/images/general/mimic.avif"
	},
	{
		"id": "paloSpeaker",
		"title": "Palo Alto Guest Speaker",
		"description": "From Palo Alto Academy",
		"path": "/images/general/palo-speaker.avif"
	},
	{
		"id": "paloWomenPanelists",
		"title": "Women In STEM Panelists",
		"description": "From Palo Alto Academy",
		"path": "/images/general/palo-women-panelists.avif"
	},
	{
		"id": "paloWomenStudents",
		"title": "Women In STEM Students",
		"description": "From Palo Alto Academy",
		"path": "/images/general/palo-women-students.avif"
	},
	{
		"id": "panel2025",
		"title": "Alumni Panelists",
		"description": "From the 2025 Alumni Panel",
		"path": "/images/general/panel-2025-alt.avif"
	},
	{
		"id": "redHatReturns",
		"title": "Red Hat Returns",
		"description": "The First Red Hat Meeting in 2 Years",
		"path": "/images/general/red-hat-returns.avif"
	},
	{
		"id": "samGigEm",
		"title": "Sam's Garbage Plate",
		"description": "From the ISTS 2025 Competition",
		"path": "/images/general/sam-gig-em.avif"
	},
	{
		"id": "skeleton",
		"title": "Group Photo with Off-Season Skeleton",
		"description": "From an Officer Social",
		"path": "/images/general/skeleton.avif"
	},
	{
		"id": "swccdc",
		"title": "Collective Hacking",
		"description": "From an SWCCDC Competition",
		"path": "/images/general/swccdc.avif"
	},
	{
		"id": "tamuctf",
		"title": "Competition Complete",
		"description": "From TAMUctf",
		"path": "/images/general/tamuctf-wide.avif"
	},
	{
		"id": "topGolf",
		"title": "Top Golf Group Photo",
		"description": "From an Officer Social",
		"path": "/images/general/top-golf.avif"
	},
	{
		"id": "fallSocial",
		"title": "Bahama Bucks and Chill",
		"description": "From a Fall Social",
		"path": "/images/general/fall-social.avif"
	}
]
